Improvement action,Points achieved,Regulations,Group,Solutions,Assessments,Categories,Test status
Determine password lifetime requirements,0/27,"ISO 27001, NIST 800-53, Data Protection Baseline",Default Group,Compliance Manager,"Data Protection Baseline, ISO 27001, NIST 800-53",Manage compliance,None
Disallow password reuse on mobile devices,0/27,"ISO 27001, NIST 800-53, Data Protection Baseline",Default Group,Intune,"Data Protection Baseline, ISO 27001, NIST 800-53",Manage devices,None
Disable unused accounts,0/27,"ISO 27001, NIST 800-53, Data Protection Baseline",Default Group,Azure Active Directory,"Data Protection Baseline, ISO 27001, NIST 800-53",Control access,None
Enable audit log search,0/27,"NIST 800-53, Data Protection Baseline",Default Group,Audit,"Data Protection Baseline, NIST 800-53",Discover and respond,None
Log off idle sessions,0/27,"ISO 27001, NIST 800-53, Data Protection Baseline",Default Group,Compliance Manager,"Data Protection Baseline, ISO 27001, NIST 800-53",Manage compliance,None
Require mobile devices to block access and report policy violations,0/27,"ISO 27001, NIST 800-53, Data Protection Baseline",Default Group,Intune,"Data Protection Baseline, ISO 27001, NIST 800-53",Manage devices,None
Require mobile devices to lock upon inactivity,0/27,"ISO 27001, NIST 800-53, Data Protection Baseline",Default Group,Intune,"Data Protection Baseline, ISO 27001, NIST 800-53",Manage devices,None
Require mobile devices to use managed email profiles,0/27,"ISO 27001, NIST 800-53, Data Protection Baseline",Default Group,Intune,"Data Protection Baseline, ISO 27001, NIST 800-53",Manage devices,None
Require mobile devices to use a password,0/27,"ISO 27001, NIST 800-53, Data Protection Baseline",Default Group,Intune,"Data Protection Baseline, ISO 27001, NIST 800-53",Manage devices,None
Require mobile devices to wipe on multiple sign-in failures,0/27,"ISO 27001, NIST 800-53, Data Protection Baseline",Default Group,Intune,"Data Protection Baseline, ISO 27001, NIST 800-53",Manage devices,None
Configure alternate contact info for all users,0/27,"NIST 800-53, Data Protection Baseline",Default Group,Azure Active Directory,"Data Protection Baseline, NIST 800-53",Control access,None
Enable client rules forwarding block,0/27,"ISO 27001, NIST 800-53, Data Protection Baseline",Default Group,Exchange Online Protection,"Data Protection Baseline, ISO 27001, NIST 800-53",Protect information,None
Configure external sharing links to expire,0/27,"ISO 27001, NIST 800-53, Data Protection Baseline",Default Group,SharePoint Online,"Data Protection Baseline, ISO 27001, NIST 800-53",Protect information,None
Control anonymous calendar sharing,0/27,"ISO 27001, NIST 800-53, Data Protection Baseline",Default Group,Microsoft 365 admin center,"Data Protection Baseline, ISO 27001, NIST 800-53",Control access,None
Create and apply a retention policy,0/27,"EU GDPR, NIST 800-53",Default Group,Information governance,"EU GDPR, NIST 800-53",Govern information,None
Automatically apply retention labels,0/27,"EU GDPR, NIST 800-53",Default Group,Records management,"EU GDPR, NIST 800-53",Govern information,None
Lock a retention policy,0/27,"ISO 27001, EU GDPR, NIST 800-53",Default Group,Information governance,"EU GDPR, ISO 27001, NIST 800-53",Govern information,None
Create and publish a retention label,0/27,"ISO 27001, EU GDPR, NIST 800-53",Default Group,Records management,"EU GDPR, ISO 27001, NIST 800-53",Govern information,None
Enable mailbox archive,0/27,"ISO 27001, NIST 800-53",Default Group,Exchange Online Protection,"ISO 27001, NIST 800-53",Protect information,None
Retain data using event-driven records management,0/27,"ISO 27001, NIST 800-53",Default Group,Records management,"ISO 27001, NIST 800-53",Govern information,None
Retain ISO supporting documentation,0/27,"ISO 27001, NIST 800-53",Default Group,Records management,"ISO 27001, NIST 800-53",Govern information,None
Define a device value,0/27,ISO 27001,Default Group,Microsoft Defender for Endpoint,ISO 27001,Protect against threats,None
Retain security policies and procedures,0/27,ISO 27001,Default Group,Records management,ISO 27001,Govern information,None
Protect your network with network protection,0/27,ISO 27001,Default Group,Microsoft Defender for Endpoint,ISO 27001,Protect against threats,None
Deploy mandatory disclaimers,0/27,ISO 27001,Default Group,Exchange Online Protection,ISO 27001,Protect information,None
Restrict user to grant consent to unmanaged applications,0/27,ISO 27001,Default Group,Azure Active Directory,ISO 27001,Control access,None
Configure authentication contact info for all users,0/27,ISO 27001,Default Group,Azure Active Directory,ISO 27001,Control access,None
Manage endpoint security in Microsoft Intune,0/27,ISO 27001,Default Group,Intune,ISO 27001,Manage devices,None
Retain nonconformity details,0/27,ISO 27001,Default Group,Records management,ISO 27001,Govern information,None
Export audit records,0/27,"ISO 27001, NIST 800-53",Default Group,Audit,"ISO 27001, NIST 800-53",Discover and respond,None
Set system message for users attempting to log on,0/27,NIST 800-53,Default Group,Windows 10,NIST 800-53,Manage devices,None
Use a data connector to archive third-party data,0/27,NIST 800-53,Default Group,Information governance,NIST 800-53,Govern information,None
Implement standardized user ID,0/27,NIST 800-53,Default Group,Azure Active Directory,NIST 800-53,Control access,None
Retain HIPAA supporting documentation,0/27,NIST 800-53,Default Group,Records management,NIST 800-53,Govern information,None
Import PST files to Office 365 in Microsoft compliance center,0/27,NIST 800-53,Default Group,Information governance,NIST 800-53,Govern information,None
Govern policies and procedures,0/9,"ISO 27001, NIST 800-53, Data Protection Baseline",Default Group,Compliance Manager,"Data Protection Baseline, ISO 27001, NIST 800-53",Manage compliance,None
Identify non-organizational users,0/9,"ISO 27001, NIST 800-53, Data Protection Baseline",Default Group,Compliance Manager,"Data Protection Baseline, ISO 27001, NIST 800-53",Manage compliance,None
Facilitate information sharing,0/9,"ISO 27001, NIST 800-53, Data Protection Baseline",Default Group,Compliance Manager,"Data Protection Baseline, ISO 27001, NIST 800-53",Manage compliance,None
Identify actions allowed without authentication,0/9,"ISO 27001, NIST 800-53, Data Protection Baseline",Default Group,Compliance Manager,"Data Protection Baseline, ISO 27001, NIST 800-53",Manage compliance,None
Conduct exit interview upon termination,0/9,"ISO 27001, NIST 800-53, Data Protection Baseline",Default Group,Compliance Manager,"Data Protection Baseline, ISO 27001, NIST 800-53",Manage compliance,None
Categorize information,0/9,"ISO 27001, NIST 800-53, Data Protection Baseline",Default Group,Microsoft Information Protection,"Data Protection Baseline, ISO 27001, NIST 800-53",Protect information,None
Assign and review position risk designations,0/9,"NIST 800-53, Data Protection Baseline",Default Group,Compliance Manager,"Data Protection Baseline, NIST 800-53",Manage compliance,None
Document security strength requirements in acquisition contracts,0/9,"ISO 27001, NIST 800-53, Data Protection Baseline",Default Group,Compliance Manager,"Data Protection Baseline, ISO 27001, NIST 800-53",Manage compliance,None
Authorize remote access,0/9,"ISO 27001, NIST 800-53, Data Protection Baseline",Default Group,Compliance Manager,"Data Protection Baseline, ISO 27001, NIST 800-53",Manage compliance,None
Document security functional requirements in acquisition contracts,0/9,"ISO 27001, NIST 800-53, Data Protection Baseline",Default Group,Compliance Manager,"Data Protection Baseline, ISO 27001, NIST 800-53",Manage compliance,None
Separate duties of individuals,0/9,"ISO 27001, NIST 800-53, Data Protection Baseline",Default Group,Compliance Manager,"Data Protection Baseline, ISO 27001, NIST 800-53",Manage compliance,None
Document security documentation requirements in acquisition contract,0/9,"ISO 27001, NIST 800-53, Data Protection Baseline",Default Group,Compliance Manager,"Data Protection Baseline, ISO 27001, NIST 800-53",Manage compliance,None
Document security assurance requirements in acquisition contracts,0/9,"ISO 27001, NIST 800-53, Data Protection Baseline",Default Group,Compliance Manager,"Data Protection Baseline, ISO 27001, NIST 800-53",Manage compliance,None
Document acquisition contract acceptance criteria,0/9,"ISO 27001, NIST 800-53, Data Protection Baseline",Default Group,Compliance Manager,"Data Protection Baseline, ISO 27001, NIST 800-53",Manage compliance,None
Assign risk designations,0/9,"ISO 27001, NIST 800-53, Data Protection Baseline",Default Group,Compliance Manager,"Data Protection Baseline, ISO 27001, NIST 800-53",Manage compliance,None
Require approval for account creation,0/9,"ISO 27001, NIST 800-53, Data Protection Baseline",Default Group,Compliance Manager,"Data Protection Baseline, ISO 27001, NIST 800-53",Manage compliance,None
Provide security training for new users,0/9,"ISO 27001, NIST 800-53, Data Protection Baseline",Default Group,Compliance Manager,"Data Protection Baseline, ISO 27001, NIST 800-53",Manage compliance,None
Implement controls to secure all media,0/9,"ISO 27001, NIST 800-53, Data Protection Baseline",Default Group,Compliance Manager,"Data Protection Baseline, ISO 27001, NIST 800-53",Manage compliance,None
Protect audit information,0/9,"ISO 27001, NIST 800-53, Data Protection Baseline",Default Group,Compliance Manager,"Data Protection Baseline, ISO 27001, NIST 800-53",Manage compliance,None
Clear personnel with access to classified information,0/9,"ISO 27001, NIST 800-53, Data Protection Baseline",Default Group,Compliance Manager,"Data Protection Baseline, ISO 27001, NIST 800-53",Manage compliance,None
Establish and document change control processes,0/9,"ISO 27001, NIST 800-53, Data Protection Baseline",Default Group,Compliance Manager,"Data Protection Baseline, ISO 27001, NIST 800-53",Manage compliance,None
Establish a secure software development program,0/9,"ISO 27001, NIST 800-53, Data Protection Baseline",Default Group,Compliance Manager,"Data Protection Baseline, ISO 27001, NIST 800-53",Manage compliance,None
Establish and maintain an asset inventory,0/9,"ISO 27001, NIST 800-53, Data Protection Baseline",Default Group,Compliance Manager,"Data Protection Baseline, ISO 27001, NIST 800-53",Manage compliance,None
Develop information security policies and procedures,0/9,"ISO 27001, NIST 800-53, Data Protection Baseline",Default Group,Compliance Manager,"Data Protection Baseline, ISO 27001, NIST 800-53",Manage compliance,None
Document security and privacy training activities,0/9,"ISO 27001, NIST 800-53, Data Protection Baseline",Default Group,Compliance Manager,"Data Protection Baseline, ISO 27001, NIST 800-53",Manage compliance,None
Document the protection of cardholder data in third party contracts,0/9,"ISO 27001, NIST 800-53, Data Protection Baseline",Default Group,Compliance Manager,"Data Protection Baseline, ISO 27001, NIST 800-53",Manage compliance,None
Perform a risk assessment,0/9,"ISO 27001, NIST 800-53, Data Protection Baseline",Default Group,Compliance Manager,"Data Protection Baseline, ISO 27001, NIST 800-53",Manage compliance,None
Develop acceptable use policies and procedures,0/9,"ISO 27001, NIST 800-53, Data Protection Baseline",Default Group,Compliance Manager,"Data Protection Baseline, ISO 27001, NIST 800-53",Manage compliance,None
Establish voip usage restrictions,0/9,"ISO 27001, NIST 800-53, Data Protection Baseline",Default Group,Compliance Manager,"Data Protection Baseline, ISO 27001, NIST 800-53",Manage compliance,None
Authorize access to intune - valid authorization,0/9,"ISO 27001, NIST 800-53, Data Protection Baseline",Default Group,Intune,"Data Protection Baseline, ISO 27001, NIST 800-53",Manage devices,None
Establish procedures for initial authenticator distribution,0/9,"ISO 27001, NIST 800-53, Data Protection Baseline",Default Group,Compliance Manager,"Data Protection Baseline, ISO 27001, NIST 800-53",Manage compliance,None
Authorize access to intune - organizational attributes,0/9,"ISO 27001, NIST 800-53, Data Protection Baseline",Default Group,Intune,"Data Protection Baseline, ISO 27001, NIST 800-53",Manage devices,None
Retrieve security-related property,0/9,"ISO 27001, NIST 800-53, Data Protection Baseline",Default Group,Compliance Manager,"Data Protection Baseline, ISO 27001, NIST 800-53",Manage compliance,None
Authorize access to intune - intended system use,0/9,"ISO 27001, NIST 800-53, Data Protection Baseline",Default Group,Intune,"Data Protection Baseline, ISO 27001, NIST 800-53",Manage devices,None
Develop security safeguards,0/9,"NIST 800-53, Data Protection Baseline",Default Group,Compliance Manager,"Data Protection Baseline, NIST 800-53",Manage compliance,None
Establish conditions for role membership,0/9,"ISO 27001, NIST 800-53, Data Protection Baseline",Default Group,Compliance Manager,"Data Protection Baseline, ISO 27001, NIST 800-53",Manage compliance,None
Manage system and admin accounts,0/9,"NIST 800-53, Data Protection Baseline",Default Group,Compliance Manager,"Data Protection Baseline, NIST 800-53",Manage compliance,None
Protect authenticators,0/9,"ISO 27001, Data Protection Baseline",Default Group,Compliance Manager,"Data Protection Baseline, ISO 27001",Manage compliance,None
Implement physical security for offices and working areas,0/9,"ISO 27001, NIST 800-53, Data Protection Baseline",Default Group,Compliance Manager,"Data Protection Baseline, ISO 27001, NIST 800-53",Manage compliance,None
Update security awareness training,0/9,"ISO 27001, Data Protection Baseline",Default Group,Compliance Manager,"Data Protection Baseline, ISO 27001",Manage compliance,None
Provide information spillage training,0/9,"ISO 27001, NIST 800-53, Data Protection Baseline",Default Group,Compliance Manager,"Data Protection Baseline, ISO 27001, NIST 800-53",Manage compliance,None
Document the information system environment in acquisition contracts,0/9,"ISO 27001, NIST 800-53, Data Protection Baseline",Default Group,Compliance Manager,"Data Protection Baseline, ISO 27001, NIST 800-53",Manage compliance,None
Update rules of behavior and access agreements,0/9,"ISO 27001, NIST 800-53, Data Protection Baseline",Default Group,Compliance Manager,"Data Protection Baseline, ISO 27001, NIST 800-53",Manage compliance,None
Update interconnection security agreements,0/9,"ISO 27001, NIST 800-53, Data Protection Baseline",Default Group,Compliance Manager,"Data Protection Baseline, ISO 27001, NIST 800-53",Manage compliance,None
Reevaluate access upon personnel transfer,0/9,"ISO 27001, NIST 800-53, Data Protection Baseline",Default Group,Compliance Manager,"Data Protection Baseline, ISO 27001, NIST 800-53",Manage compliance,None
Update information security policies,0/9,"ISO 27001, NIST 800-53, Data Protection Baseline",Default Group,Compliance Manager,"Data Protection Baseline, ISO 27001, NIST 800-53",Manage compliance,None
Modify access authorizations upon personnel transfer,0/9,"ISO 27001, NIST 800-53, Data Protection Baseline",Default Group,Compliance Manager,"Data Protection Baseline, ISO 27001, NIST 800-53",Manage compliance,None
Review and sign revised rules of behavior,0/9,"ISO 27001, NIST 800-53, Data Protection Baseline",Default Group,Compliance Manager,"Data Protection Baseline, ISO 27001, NIST 800-53",Manage compliance,None
Provide security training before providing access,0/9,"ISO 27001, NIST 800-53, Data Protection Baseline",Default Group,Compliance Manager,"Data Protection Baseline, ISO 27001, NIST 800-53",Manage compliance,None
Implement formal sanctions process,0/9,"ISO 27001, NIST 800-53, Data Protection Baseline",Default Group,Compliance Manager,"Data Protection Baseline, ISO 27001, NIST 800-53",Manage compliance,None
Develop access control policies for ePHI,0/9,Data Protection Baseline,Default Group,Compliance Manager,Data Protection Baseline,Manage compliance,None
Provide role-based security training,0/9,"ISO 27001, NIST 800-53, Data Protection Baseline",Default Group,Compliance Manager,"Data Protection Baseline, ISO 27001, NIST 800-53",Manage compliance,None
Document access privileges,0/9,"NIST 800-53, Data Protection Baseline",Default Group,Compliance Manager,"Data Protection Baseline, NIST 800-53",Manage compliance,None
Document separation of duties,0/9,"ISO 27001, NIST 800-53, Data Protection Baseline",Default Group,Compliance Manager,"Data Protection Baseline, ISO 27001, NIST 800-53",Manage compliance,None
Provide security awareness training,0/9,"ISO 27001, Data Protection Baseline",Default Group,Compliance Manager,"Data Protection Baseline, ISO 27001",Manage compliance,None
Document wireless access guidelines,0/9,"NIST 800-53, Data Protection Baseline",Default Group,Compliance Manager,"Data Protection Baseline, NIST 800-53",Manage compliance,None
Manage symmetric cryptographic keys,0/9,"ISO 27001, NIST 800-53, Data Protection Baseline",Default Group,Compliance Manager,"Data Protection Baseline, ISO 27001, NIST 800-53",Manage compliance,None
Implement personnel screening,0/9,"ISO 27001, NIST 800-53, Data Protection Baseline",Default Group,Compliance Manager,"Data Protection Baseline, ISO 27001, NIST 800-53",Manage compliance,None
Require users to sign access agreement,0/9,"ISO 27001, NIST 800-53, Data Protection Baseline",Default Group,Compliance Manager,"Data Protection Baseline, ISO 27001, NIST 800-53",Manage compliance,None
Define and enforce conditions for shared and group accounts,0/9,"ISO 27001, NIST 800-53, Data Protection Baseline",Default Group,Compliance Manager,"Data Protection Baseline, ISO 27001, NIST 800-53",Manage compliance,None
Review access control policies and procedures,0/9,"ISO 27001, NIST 800-53, Data Protection Baseline",Default Group,Compliance Manager,"Data Protection Baseline, ISO 27001, NIST 800-53",Manage compliance,None
Define information system account types,0/9,"ISO 27001, NIST 800-53, Data Protection Baseline",Default Group,Compliance Manager,"Data Protection Baseline, ISO 27001, NIST 800-53",Manage compliance,None
Reissue authenticators for changed groups and accounts,0/9,"NIST 800-53, Data Protection Baseline",Default Group,Compliance Manager,"Data Protection Baseline, NIST 800-53",Manage compliance,None
Document requirements for the use of shared data in contracts,0/9,"ISO 27001, NIST 800-53, Data Protection Baseline",Default Group,Compliance Manager,"Data Protection Baseline, ISO 27001, NIST 800-53",Manage compliance,None
Initiate transfer or reassignment actions,0/9,"NIST 800-53, Data Protection Baseline",Default Group,Compliance Manager,"Data Protection Baseline, NIST 800-53",Manage compliance,None
Document protection of security information in acquisition contracts,0/9,"ISO 27001, NIST 800-53, Data Protection Baseline",Default Group,Compliance Manager,"Data Protection Baseline, ISO 27001, NIST 800-53",Manage compliance,None
Understand your responsibilities regarding dpias,0/9,"EU GDPR, Data Protection Baseline",Default Group,Compliance Manager,"Data Protection Baseline, EU GDPR",Manage compliance,None
Establish procedures for the collection and processing of data belonging to children and adolescents,0/9,"EU GDPR, Data Protection Baseline",Default Group,Compliance Manager,"Data Protection Baseline, EU GDPR",Manage compliance,None
Protect incident response plan,0/9,"ISO 27001, NIST 800-53, Data Protection Baseline",Default Group,Compliance Manager,"Data Protection Baseline, ISO 27001, NIST 800-53",Manage compliance,None
Establish requirements for audit review and reporting,0/9,"NIST 800-53, Data Protection Baseline",Default Group,Compliance Manager,"Data Protection Baseline, NIST 800-53",Manage compliance,None
Define and establish security and privacy attributes,0/9,"NIST 800-53, Data Protection Baseline",Default Group,Compliance Manager,"Data Protection Baseline, NIST 800-53",Manage compliance,None
Document organizational access agreements,0/9,"ISO 27001, NIST 800-53, Data Protection Baseline",Default Group,Compliance Manager,"Data Protection Baseline, ISO 27001, NIST 800-53",Manage compliance,None
Update role-based security training,0/9,"ISO 27001, Data Protection Baseline",Default Group,Compliance Manager,"Data Protection Baseline, ISO 27001",Manage compliance,None
Map authenticated identities to individuals,0/9,"ISO 27001, NIST 800-53, Data Protection Baseline",Default Group,Compliance Manager,"Data Protection Baseline, ISO 27001, NIST 800-53",Manage compliance,None
Conduct incident response testing,0/9,"NIST 800-53, Data Protection Baseline",Default Group,Compliance Manager,"Data Protection Baseline, NIST 800-53",Manage compliance,None
Employ least privilege access,0/9,"ISO 27001, NIST 800-53, Data Protection Baseline",Default Group,Compliance Manager,"Data Protection Baseline, ISO 27001, NIST 800-53",Manage compliance,None
Document third-party security requirements,0/9,"ISO 27001, NIST 800-53, Data Protection Baseline",Default Group,Compliance Manager,"Data Protection Baseline, ISO 27001, NIST 800-53",Manage compliance,None
Synchronize server clocks with nist ntp servers,0/9,"ISO 27001, NIST 800-53, Data Protection Baseline",Default Group,Compliance Manager,"Data Protection Baseline, ISO 27001, NIST 800-53",Manage compliance,None
Document remote access guidelines,0/9,"ISO 27001, NIST 800-53, Data Protection Baseline",Default Group,Compliance Manager,"Data Protection Baseline, ISO 27001, NIST 800-53",Manage compliance,None
Develop audit and accountability policies and procedures,0/9,"ISO 27001, NIST 800-53, Data Protection Baseline",Default Group,Compliance Manager,"Data Protection Baseline, ISO 27001, NIST 800-53",Manage compliance,None
Develop access control policies and procedures,0/9,"ISO 27001, NIST 800-53, Data Protection Baseline",Default Group,Compliance Manager,"Data Protection Baseline, ISO 27001, NIST 800-53",Manage compliance,None
Confirm accuracy of collected personal data,0/9,"EU GDPR, Data Protection Baseline",Default Group,Compliance Manager,"Data Protection Baseline, EU GDPR",Manage compliance,None
Restrict access to privileged accounts,0/9,"ISO 27001, NIST 800-53, Data Protection Baseline",Default Group,Azure Active Directory,"Data Protection Baseline, ISO 27001, NIST 800-53",Control access,None
Provide anti-malware training,0/9,"ISO 27001, NIST 800-53, Data Protection Baseline",Default Group,Compliance Manager,"Data Protection Baseline, ISO 27001, NIST 800-53",Manage compliance,None
Authorize wireless access,0/9,"NIST 800-53, Data Protection Baseline",Default Group,Compliance Manager,"Data Protection Baseline, NIST 800-53",Manage compliance,None
Develop an incident response plan,0/9,"ISO 27001, NIST 800-53, Data Protection Baseline",Default Group,Compliance Manager,"Data Protection Baseline, ISO 27001, NIST 800-53",Manage compliance,None
"Authorize, monitor, and control voip",0/9,"ISO 27001, NIST 800-53, Data Protection Baseline",Default Group,Compliance Manager,"Data Protection Baseline, ISO 27001, NIST 800-53",Manage compliance,None
Authorize access to Office 365 - valid authorization,0/9,"ISO 27001, NIST 800-53, Data Protection Baseline",Default Group,Compliance Manager,"Data Protection Baseline, ISO 27001, NIST 800-53",Manage compliance,None
Define access authorizations to support separation of duties,0/9,"ISO 27001, NIST 800-53, Data Protection Baseline",Default Group,Compliance Manager,"Data Protection Baseline, ISO 27001, NIST 800-53",Manage compliance,None
Re-screen personnel at appropriate intervals,0/9,"ISO 27001, NIST 800-53, Data Protection Baseline",Default Group,Compliance Manager,"Data Protection Baseline, ISO 27001, NIST 800-53",Manage compliance,None
Authorize access to security functions and information,0/9,"ISO 27001, NIST 800-53, Data Protection Baseline",Default Group,Compliance Manager,"Data Protection Baseline, ISO 27001, NIST 800-53",Manage compliance,None
Authorize access to Office 365 - intended system use,0/9,"ISO 27001, NIST 800-53, Data Protection Baseline",Default Group,Compliance Manager,"Data Protection Baseline, ISO 27001, NIST 800-53",Manage compliance,None
Assign account managers,0/9,"NIST 800-53, Data Protection Baseline",Default Group,Compliance Manager,"Data Protection Baseline, NIST 800-53",Manage compliance,None
Perform a business impact assessment and application criticality assessment,0/9,"ISO 27001, NIST 800-53, Data Protection Baseline",Default Group,Compliance Manager,"Data Protection Baseline, ISO 27001, NIST 800-53",Manage compliance,None
Control use of portable storage devices,0/9,"ISO 27001, NIST 800-53, Data Protection Baseline",Default Group,Compliance Manager,"Data Protection Baseline, ISO 27001, NIST 800-53",Manage compliance,None
Control information flow,0/9,"ISO 27001, NIST 800-53, Data Protection Baseline",Default Group,Compliance Manager,"Data Protection Baseline, ISO 27001, NIST 800-53",Manage compliance,None
Update organizational access agreements,0/9,"ISO 27001, NIST 800-53, Data Protection Baseline",Default Group,Compliance Manager,"Data Protection Baseline, ISO 27001, NIST 800-53",Manage compliance,None
Monitor privileged role assignment,0/9,"ISO 27001, NIST 800-53, Data Protection Baseline",Default Group,Compliance Manager,"Data Protection Baseline, ISO 27001, NIST 800-53",Manage compliance,None
Authorize access to Office 365 - organizational attributes,0/9,"ISO 27001, NIST 800-53, Data Protection Baseline",Default Group,Compliance Manager,"Data Protection Baseline, ISO 27001, NIST 800-53",Manage compliance,None
Enable Sensitivity Labels for SharePoint Online and OneDrive,0/9,Data Protection Baseline,Default Group,Microsoft Information Protection,Data Protection Baseline,Protect information,None
Require compliance with business continuity and disaster recovery requirements,0/9,Data Protection Baseline,Default Group,Compliance Manager,Data Protection Baseline,Manage compliance,None
