Improvement action,Points achieved,Regulations,Group,Solutions,Assessments,Categories,Test status
Pseudonymize or de-identify personal data,0/9,"ISO 27001, EU GDPR, Data Protection Baseline",Default Group,Compliance Manager,"Data Protection Baseline, EU GDPR, ISO 27001",Manage compliance,None
Records of personal data processing,0/9,"EU GDPR, Data Protection Baseline",Default Group,Compliance Manager,"Data Protection Baseline, EU GDPR",Manage compliance,None
Provide data breach training,0/9,"ISO 27001, EU GDPR, Data Protection Baseline",Default Group,Compliance Manager,"Data Protection Baseline, EU GDPR, ISO 27001",Manage compliance,None
Record disclosures of PII to third parties,0/9,"EU GDPR, Data Protection Baseline",Default Group,Compliance Manager,"Data Protection Baseline, EU GDPR",Manage compliance,None
Designate union representative,0/9,EU GDPR,Default Group,Compliance Manager,EU GDPR,Manage compliance,None
Establish a privacy program,0/9,"ISO 27001, EU GDPR, NIST 800-53",Default Group,Compliance Manager,"EU GDPR, ISO 27001, NIST 800-53",Manage compliance,None
Develop a private data processing procedure,0/9,EU GDPR,Default Group,Compliance Manager,EU GDPR,Manage compliance,None
Verify consumer identity,0/9,EU GDPR,Default Group,Compliance Manager,EU GDPR,Manage compliance,None
Prohibit consumer discrimination,0/9,EU GDPR,Default Group,Compliance Manager,EU GDPR,Manage compliance,None
Understand requirements for financial incentives,0/9,EU GDPR,Default Group,Compliance Manager,EU GDPR,Manage compliance,None
Restrict the processing of identifiers,0/9,EU GDPR,Default Group,Compliance Manager,EU GDPR,Manage compliance,None
Adhere to retention periods defined,0/9,"ISO 27001, EU GDPR, NIST 800-53",Default Group,Compliance Manager,"EU GDPR, ISO 27001, NIST 800-53",Manage compliance,None
Maintain data breach records,0/9,"EU GDPR, NIST 800-53",Default Group,Compliance Manager,"EU GDPR, NIST 800-53",Manage compliance,None
Disallow data-based discrimination,0/9,EU GDPR,Default Group,Compliance Manager,EU GDPR,Manage compliance,None
Prohibit data profiling during automated data processing,0/9,EU GDPR,Default Group,Compliance Manager,EU GDPR,Manage compliance,None
Determine the requirements for joint data processing,0/9,EU GDPR,Default Group,Compliance Manager,EU GDPR,Manage compliance,None
Require compliance with data portability requirements,0/9,EU GDPR,Default Group,Compliance Manager,EU GDPR,Manage compliance,None
"Adopt security, technical, and administrative measures to protect personal data",0/9,"ISO 27001, EU GDPR",Default Group,Compliance Manager,"EU GDPR, ISO 27001",Manage compliance,None
Complete third party information notices,0/9,EU GDPR,Default Group,Compliance Manager,EU GDPR,Manage compliance,None
Consumer financial incentives opt out rights,0/9,EU GDPR,Default Group,Compliance Manager,EU GDPR,Manage compliance,None
Define the duties of processors,0/9,EU GDPR,Default Group,Compliance Manager,EU GDPR,Manage compliance,None
Develop a data handling policy,0/9,"ISO 27001, EU GDPR",Default Group,Compliance Manager,"EU GDPR, ISO 27001",Manage compliance,None
Develop a data transfer policy,0/9,"ISO 27001, EU GDPR",Default Group,Compliance Manager,"EU GDPR, ISO 27001",Manage compliance,None
Discoverable privacy notification,0/9,EU GDPR,Default Group,Compliance Manager,EU GDPR,Manage compliance,None
Determine the requirements for cross-border transmissions,0/9,"ISO 27001, EU GDPR",Default Group,Compliance Manager,"EU GDPR, ISO 27001",Manage compliance,None
Determine organization role,0/9,EU GDPR,Default Group,Compliance Manager,EU GDPR,Manage compliance,None
Document and distribute a privacy policy,0/9,"ISO 27001, EU GDPR",Default Group,Compliance Manager,"EU GDPR, ISO 27001",Manage compliance,None
Document the legal basis for processing personal information,0/9,"ISO 27001, EU GDPR",Default Group,Compliance Manager,"EU GDPR, ISO 27001",Manage compliance,None
Establish and adhere to binding corporate rules,0/9,"ISO 27001, EU GDPR",Default Group,Compliance Manager,"EU GDPR, ISO 27001",Manage compliance,None
Establish requirements for processing personal data related to criminal convictions,0/9,"ISO 27001, EU GDPR",Default Group,Compliance Manager,"EU GDPR, ISO 27001",Manage compliance,None
Implement methods for consumer requests,0/9,EU GDPR,Default Group,Compliance Manager,EU GDPR,Manage compliance,None
Inform data subjects of their rights,0/9,EU GDPR,Default Group,Compliance Manager,EU GDPR,Manage compliance,None
Incorporate security and data privacy practices in research processing,0/9,"ISO 27001, EU GDPR",Default Group,Compliance Manager,"EU GDPR, ISO 27001",Manage compliance,None
Limit disclosure of personal information in disciplinary proceedings,0/9,"ISO 27001, EU GDPR",Default Group,Compliance Manager,"EU GDPR, ISO 27001",Manage compliance,None
Limit sensitive evidence collection,0/9,"ISO 27001, EU GDPR",Default Group,Compliance Manager,"EU GDPR, ISO 27001",Manage compliance,None
Information security and personal data protection,0/9,"ISO 27001, EU GDPR",Default Group,Compliance Manager,"EU GDPR, ISO 27001",Manage compliance,None
Manage a registry process,0/9,EU GDPR,Default Group,Compliance Manager,EU GDPR,Manage compliance,None
Manage cross-border data transfers,0/9,"ISO 27001, EU GDPR",Default Group,Compliance Manager,"EU GDPR, ISO 27001",Manage compliance,None
Protect personal data,0/9,"ISO 27001, EU GDPR",Default Group,Compliance Manager,"EU GDPR, ISO 27001",Manage compliance,None
Restrict the processing of personal data,0/9,"ISO 27001, EU GDPR",Default Group,Compliance Manager,"EU GDPR, ISO 27001",Manage compliance,None
Supervise personnel handling personal information,0/9,"ISO 27001, EU GDPR",Default Group,Compliance Manager,"EU GDPR, ISO 27001",Manage compliance,None
Understand requirements for providing access to personal data,0/9,"ISO 27001, EU GDPR",Default Group,Compliance Manager,"EU GDPR, ISO 27001",Manage compliance,None
Support personal verification credentials issued by legal authorities,0/9,"ISO 27001, NIST 800-53",Default Group,Compliance Manager,"ISO 27001, NIST 800-53",Manage compliance,None
Maintain a list of third parties,0/9,ISO 27001,Default Group,Compliance Manager,ISO 27001,Manage compliance,None
Develop identification and authentication policies and procedures,0/9,ISO 27001,Default Group,Compliance Manager,ISO 27001,Manage compliance,None
Establish an information security program,0/9,ISO 27001,Default Group,Compliance Manager,ISO 27001,Manage compliance,None
Develop organization code of conduct policy,0/9,ISO 27001,Default Group,Compliance Manager,ISO 27001,Manage compliance,None
Publish periodic security reminders,0/9,ISO 27001,Default Group,Compliance Manager,ISO 27001,Manage compliance,None
Document terms and conditions for external information systems,0/9,"ISO 27001, NIST 800-53",Default Group,Compliance Manager,"ISO 27001, NIST 800-53",Manage compliance,None
Synchronize server clocks,0/9,"ISO 27001, NIST 800-53",Default Group,Compliance Manager,"ISO 27001, NIST 800-53",Manage compliance,None
Develop a media library protection policy,0/9,ISO 27001,Default Group,Compliance Manager,ISO 27001,Manage compliance,None
Develop and document a governance plan,0/9,ISO 27001,Default Group,Compliance Manager,ISO 27001,Manage compliance,None
Develop and maintain a risk management framework,0/9,ISO 27001,Default Group,Compliance Manager,ISO 27001,Manage compliance,None
Implement logging and monitoring of applications,0/9,ISO 27001,Default Group,Compliance Manager,ISO 27001,Manage compliance,None
Establish a data governance model,0/9,ISO 27001,Default Group,Compliance Manager,ISO 27001,Manage compliance,None
Develop and maintain a vulnerability management standard,0/9,ISO 27001,Default Group,Compliance Manager,ISO 27001,Manage compliance,None
Establish organizational leadership,0/9,ISO 27001,Default Group,Compliance Manager,ISO 27001,Manage compliance,None
Create stakeholder values,0/9,ISO 27001,Default Group,Compliance Manager,ISO 27001,Manage compliance,None
Implement an enrollment process,0/9,ISO 27001,Default Group,Compliance Manager,ISO 27001,Manage compliance,None
Define and document communication needs,0/9,ISO 27001,Default Group,Compliance Manager,ISO 27001,Manage compliance,None
"Establish roles, responsibilities and qualifications of designated personnel",0/9,ISO 27001,Default Group,Compliance Manager,ISO 27001,Manage compliance,None
Establish and document remediation processes,0/9,ISO 27001,Default Group,Compliance Manager,ISO 27001,Manage compliance,None
Establish electronic system procedures,0/9,ISO 27001,Default Group,Compliance Manager,ISO 27001,Manage compliance,None
Submit information to authorities,0/9,ISO 27001,Default Group,Compliance Manager,ISO 27001,Manage compliance,None
Establish traceability of controls,0/9,ISO 27001,Default Group,Compliance Manager,ISO 27001,Manage compliance,None
Allocate responsibility for operational tasks,0/9,ISO 27001,Default Group,Compliance Manager,ISO 27001,Manage compliance,None
"Prohibit the use, aquisition and supply of address harvesting software and harvested lists",0/9,ISO 27001,Default Group,Compliance Manager,ISO 27001,Manage compliance,None
Develop procedures for sending electronic messages,0/9,ISO 27001,Default Group,Compliance Manager,ISO 27001,Manage compliance,None
Implement and optimize IT capabilities,0/9,ISO 27001,Default Group,Compliance Manager,ISO 27001,Manage compliance,None
Define business functional and technical requirements,0/9,ISO 27001,Default Group,Compliance Manager,ISO 27001,Manage compliance,None
Manage networks with SDN,0/9,ISO 27001,Default Group,Compliance Manager,ISO 27001,Manage compliance,None
Establish a technology adoption strategy,0/9,ISO 27001,Default Group,Compliance Manager,ISO 27001,Manage compliance,None
Understand the legal requirements for data messages,0/9,ISO 27001,Default Group,Compliance Manager,ISO 27001,Manage compliance,None
Establish a security operations center,0/9,ISO 27001,Default Group,Compliance Manager,ISO 27001,Manage compliance,None
Establish a data storage and recovery strategy,0/9,ISO 27001,Default Group,Compliance Manager,ISO 27001,Manage compliance,None
Develop procedures for sending sexually oriented electronic messages,0/9,ISO 27001,Default Group,Compliance Manager,ISO 27001,Manage compliance,None
Develop and document a crisis management plan,0/9,ISO 27001,Default Group,Compliance Manager,ISO 27001,Manage compliance,None
"Search, view, and export records",0/9,ISO 27001,Default Group,Compliance Manager,ISO 27001,Manage compliance,None
Optimize and manage capacity requirements,0/9,ISO 27001,Default Group,Compliance Manager,ISO 27001,Manage compliance,None
Utilize software development frameworks and libraries,0/9,ISO 27001,Default Group,Compliance Manager,ISO 27001,Manage compliance,None
Adopt an IT implementation method,0/9,ISO 27001,Default Group,Compliance Manager,ISO 27001,Manage compliance,None
Manage organizational projects,0/9,ISO 27001,Default Group,Compliance Manager,ISO 27001,Manage compliance,None
Integrate a digital transformation strategy,0/9,ISO 27001,Default Group,Compliance Manager,ISO 27001,Manage compliance,None
Restrict access to source code,0/9,ISO 27001,Default Group,Compliance Manager,ISO 27001,Manage compliance,None
Prohibit unfair practices,0/9,ISO 27001,Default Group,Compliance Manager,ISO 27001,Manage compliance,None
Implement adequate security measures,0/9,ISO 27001,Default Group,Compliance Manager,ISO 27001,Manage compliance,None
Govern and secure electronic transactions,0/9,ISO 27001,Default Group,Compliance Manager,ISO 27001,Manage compliance,None
Update rules of behavior and access agreements every 3 years,0/9,"ISO 27001, NIST 800-53",Default Group,Compliance Manager,"ISO 27001, NIST 800-53",Manage compliance,None
Secure integrated voice response systems,0/9,ISO 27001,Default Group,Compliance Manager,ISO 27001,Manage compliance,None
Secure multi-functional devices and high-volume printers,0/9,ISO 27001,Default Group,Compliance Manager,ISO 27001,Manage compliance,None
Define requirements for protecting electronic payment systems,0/9,ISO 27001,Default Group,Compliance Manager,ISO 27001,Manage compliance,None
Establish parameters for searching secret authenticators and verifiers,0/9,ISO 27001,Default Group,Compliance Manager,ISO 27001,Manage compliance,None
Secure infrastructure,0/9,ISO 27001,Default Group,Compliance Manager,ISO 27001,Manage compliance,None
Secure cookies,0/9,ISO 27001,Default Group,Compliance Manager,ISO 27001,Manage compliance,None
Restrict the use of non-switched devices,0/9,ISO 27001,Default Group,Compliance Manager,ISO 27001,Manage compliance,None
Provide security awareness training for insider threats,0/9,NIST 800-53,Default Group,Compliance Manager,NIST 800-53,Manage compliance,None
Use profiles that conform to ficam,0/9,NIST 800-53,Default Group,Compliance Manager,NIST 800-53,Manage compliance,None
Retain and secure records as required by the by the u.s. securities and exchange commission rule 17a-4,0/9,NIST 800-53,Default Group,Compliance Manager,NIST 800-53,Manage compliance,None
Distribute authenticators,0/9,NIST 800-53,Default Group,Compliance Manager,NIST 800-53,Manage compliance,None
Require FICAM-approved components,0/9,NIST 800-53,Default Group,Compliance Manager,NIST 800-53,Manage compliance,None
Require ficam-approved third-party credentials,0/9,NIST 800-53,Default Group,Azure Active Directory,NIST 800-53,Control access,None
Enable mobile device remote wipe,0/3,"ISO 27001, NIST 800-53, Data Protection Baseline",Default Group,Intune,"Data Protection Baseline, ISO 27001, NIST 800-53",Manage devices,None
Revoke email encrypted by Office 365 Advanced Message Encryption,0/3,"NIST 800-53, Data Protection Baseline",Default Group,Microsoft Information Protection,"Data Protection Baseline, NIST 800-53",Protect information,None
Review and remediate cloud anomaly detection alerts,0/3,"NIST 800-53, Data Protection Baseline",Default Group,Cloud App Security,"Data Protection Baseline, NIST 800-53",Discover and respond,Could not be detected
Set automated notifications for new and trending cloud applications in your organization,0/3,"ISO 27001, NIST 800-53, Data Protection Baseline",Default Group,Cloud App Security,"Data Protection Baseline, ISO 27001, NIST 800-53",Discover and respond,Could not be detected
Use Cloud App Security to detect anomalous behavior,0/3,"NIST 800-53, Data Protection Baseline",Default Group,Cloud App Security,"Data Protection Baseline, NIST 800-53",Discover and respond,None
Enable detection of network devices,0/3,"ISO 27001, NIST 800-53, Data Protection Baseline",Default Group,Intune,"Data Protection Baseline, ISO 27001, NIST 800-53",Manage devices,None
Use Office 365 ATP Threat Protection status reports for trend analysis,0/3,"ISO 27001, NIST 800-53, Data Protection Baseline",Default Group,Microsoft Defender for Office 365,"Data Protection Baseline, ISO 27001, NIST 800-53",Protect against threats,None
Use Office 365 ATP Threat Tracker for threat intelligence,0/3,"ISO 27001, NIST 800-53, Data Protection Baseline",Default Group,Microsoft Defender for Office 365,"Data Protection Baseline, ISO 27001, NIST 800-53",Protect against threats,None
Report atypical usage,0/3,Data Protection Baseline,Default Group,Audit,Data Protection Baseline,Discover and respond,None
Govern discovered apps,0/3,"ISO 27001, NIST 800-53, Data Protection Baseline",Default Group,Cloud App Security,"Data Protection Baseline, ISO 27001, NIST 800-53",Discover and respond,None
Remediate communication compliance alerts,0/3,Data Protection Baseline,Default Group,Communication compliance,Data Protection Baseline,Manage internal risks,None
Discover and review trends in shadow IT application usage,0/3,"ISO 27001, NIST 800-53, Data Protection Baseline",Default Group,Cloud App Security,"Data Protection Baseline, ISO 27001, NIST 800-53",Discover and respond,Could not be detected
Review the Azure activity log,0/3,"NIST 800-53, Data Protection Baseline",Default Group,Azure,"Data Protection Baseline, NIST 800-53",Discover and respond,None
Review the threat analytics dashboard,0/3,"NIST 800-53, Data Protection Baseline",Default Group,Microsoft Defender for Endpoint,"Data Protection Baseline, NIST 800-53",Protect against threats,None
Review controlled folder access events,0/3,"NIST 800-53, Data Protection Baseline",Default Group,Microsoft Defender for Endpoint,"Data Protection Baseline, NIST 800-53",Protect against threats,None
Manage incidents in Microsoft Defender ATP,0/3,"NIST 800-53, Data Protection Baseline",Default Group,Microsoft Defender for Endpoint,"Data Protection Baseline, NIST 800-53",Protect against threats,None
Use advanced eDiscovery Cases to support legal investigations,0/3,"ISO 27001, NIST 800-53, Data Protection Baseline",Default Group,eDiscovery,"Data Protection Baseline, ISO 27001, NIST 800-53",Discover and respond,None
Monitor communications for regulatory compliance,0/3,Data Protection Baseline,Default Group,Communication compliance,Data Protection Baseline,Manage internal risks,None
Use automated investigation and remediation capabilities in Microsoft Defender ATP,0/3,"ISO 27001, NIST 800-53, Data Protection Baseline",Default Group,Microsoft Defender for Endpoint,"Data Protection Baseline, ISO 27001, NIST 800-53",Protect against threats,None
"Create, configure, and turn on custom alert policies",0/3,"NIST 800-53, Data Protection Baseline",Default Group,Audit,"Data Protection Baseline, NIST 800-53",Discover and respond,None
Investigate and remediate delivered malicious emails,0/3,"NIST 800-53, Data Protection Baseline",Default Group,Microsoft Defender for Office 365,"Data Protection Baseline, NIST 800-53",Protect against threats,None
Investigate components associated with a Microsoft Defender ATP alert,0/3,"ISO 27001, NIST 800-53, Data Protection Baseline",Default Group,Microsoft Defender for Endpoint,"Data Protection Baseline, ISO 27001, NIST 800-53",Protect against threats,None
Investigate compromised accounts using audit,0/3,"NIST 800-53, Data Protection Baseline",Default Group,Audit,"Data Protection Baseline, NIST 800-53",Discover and respond,None
Use Microsoft Defender Antivirus for block at first sight,0/3,"ISO 27001, NIST 800-53, Data Protection Baseline",Default Group,Microsoft Defender for Endpoint,"Data Protection Baseline, ISO 27001, NIST 800-53",Protect against threats,None
Investigate entities on devices using live response in Microsoft Defender ATP,0/3,"ISO 27001, NIST 800-53, Data Protection Baseline",Default Group,Microsoft Defender for Endpoint,"Data Protection Baseline, ISO 27001, NIST 800-53",Protect against threats,None
Use Microsoft Defender ATP for threat and vulnerability management,0/3,"ISO 27001, NIST 800-53, Data Protection Baseline",Default Group,Microsoft Defender for Endpoint,"Data Protection Baseline, ISO 27001, NIST 800-53",Protect against threats,None
Investigate incidents in Microsoft Defender ATP,0/3,"ISO 27001, NIST 800-53, Data Protection Baseline",Default Group,Microsoft Defender for Endpoint,"Data Protection Baseline, ISO 27001, NIST 800-53",Protect against threats,None
Use Microsoft Defender ATP to identify and investigate software vulnerabilities,0/3,"ISO 27001, NIST 800-53, Data Protection Baseline",Default Group,Microsoft Defender for Endpoint,"Data Protection Baseline, ISO 27001, NIST 800-53",Protect against threats,None
Use Microsoft Defender ATP to remediate threats and vulnerabilities,0/3,"ISO 27001, NIST 800-53, Data Protection Baseline",Default Group,Microsoft Defender for Endpoint,"Data Protection Baseline, ISO 27001, NIST 800-53",Protect against threats,None
Use Microsoft Defender ATP to review the software inventory,0/3,"ISO 27001, NIST 800-53, Data Protection Baseline",Default Group,Microsoft Defender for Endpoint,"Data Protection Baseline, ISO 27001, NIST 800-53",Protect against threats,None
Use Microsoft Defender ATP to view event timelines,0/3,"NIST 800-53, Data Protection Baseline",Default Group,Microsoft Defender for Endpoint,"Data Protection Baseline, NIST 800-53",Protect against threats,None
Use Office 365 ATP to automate investigation and response,0/3,"ISO 27001, NIST 800-53, Data Protection Baseline",Default Group,Microsoft Defender for Office 365,"Data Protection Baseline, ISO 27001, NIST 800-53",Protect against threats,None
Use Office 365 ATP to remediate compromised user accounts,0/3,"NIST 800-53, Data Protection Baseline",Default Group,Microsoft Defender for Office 365,"Data Protection Baseline, NIST 800-53",Protect against threats,None
Use Office 365 ATP to View and Investigate Restricted Users,0/3,"NIST 800-53, Data Protection Baseline",Default Group,Microsoft Defender for Office 365,"Data Protection Baseline, NIST 800-53",Protect against threats,None
Create a custom activity policy to discover suspicious usage patterns,0/3,"NIST 800-53, Data Protection Baseline",Default Group,Cloud App Security,"Data Protection Baseline, NIST 800-53",Discover and respond,Could not be detected
Quarantine messages,0/3,"NIST 800-53, Data Protection Baseline",Default Group,Exchange Online Protection,"Data Protection Baseline, NIST 800-53",Protect information,None
View device health and compliance report in Microsoft Defender ATP,0/3,"ISO 27001, NIST 800-53, Data Protection Baseline",Default Group,Microsoft Defender for Endpoint,"Data Protection Baseline, ISO 27001, NIST 800-53",Protect against threats,None
View threat protection report in Microsoft Defender ATP,0/3,"ISO 27001, NIST 800-53, Data Protection Baseline",Default Group,Microsoft Defender for Endpoint,"Data Protection Baseline, ISO 27001, NIST 800-53",Protect against threats,None
Use Office 365 ATP Threat Explorer (or Real-Time Threat Detection),0/3,"ISO 27001, NIST 800-53, Data Protection Baseline",Default Group,Microsoft Defender for Office 365,"Data Protection Baseline, ISO 27001, NIST 800-53",Protect against threats,None
Revoke emergency/temporary access,0/3,"ISO 27001, NIST 800-53, Data Protection Baseline",Default Group,Azure Active Directory,"Data Protection Baseline, ISO 27001, NIST 800-53",Control access,None
Review and approve remediation actions in Microsoft Defender ATP,0/3,"ISO 27001, NIST 800-53, Data Protection Baseline",Default Group,Microsoft Defender for Endpoint,"Data Protection Baseline, ISO 27001, NIST 800-53",Protect against threats,None
Review alerts trigged by alert policies,0/3,"NIST 800-53, Data Protection Baseline",Default Group,Audit,"Data Protection Baseline, NIST 800-53",Discover and respond,None
Create and manage custom detection rules in Microsoft Defender ATP,0/3,"ISO 27001, NIST 800-53, Data Protection Baseline",Default Group,Microsoft Defender for Endpoint,"Data Protection Baseline, ISO 27001, NIST 800-53",Protect against threats,None
Review audit and sign-in logs in Azure Active Directory,0/3,"NIST 800-53, Data Protection Baseline",Default Group,Azure Active Directory,"Data Protection Baseline, NIST 800-53",Control access,None
Monitor communications for offensive or threatening language,0/3,Data Protection Baseline,Default Group,Communication compliance,Data Protection Baseline,Manage internal risks,None
Review content containing sensitive data using Content Explorer,0/3,"NIST 800-53, Data Protection Baseline",Default Group,Microsoft Information Protection,"Data Protection Baseline, NIST 800-53",Protect information,None
Review cloud service provider’s compliance with policies and agreements,0/3,"ISO 27001, NIST 800-53, Data Protection Baseline",Default Group,Compliance Manager,"Data Protection Baseline, ISO 27001, NIST 800-53",Manage compliance,None
Create custom sensitive information types,0/3,"ISO 27001, EU GDPR, NIST 800-53, Data Protection Baseline",Default Group,Data classification,"Data Protection Baseline, EU GDPR, ISO 27001, NIST 800-53",Protect information,None
Monitor communications for sensitive information,0/3,"ISO 27001, EU GDPR, Data Protection Baseline",Default Group,Communication compliance,"Data Protection Baseline, EU GDPR, ISO 27001",Manage internal risks,None
Monitor communications using a customized policy,0/3,"ISO 27001, EU GDPR, Data Protection Baseline",Default Group,Communication compliance,"Data Protection Baseline, EU GDPR, ISO 27001",Manage internal risks,None
Review Cloud Discovery snapshot report,0/3,"ISO 27001, NIST 800-53, Data Protection Baseline",Default Group,Cloud App Security,"Data Protection Baseline, ISO 27001, NIST 800-53",Discover and respond,None
Use DSR cases to respond to data subject requests,0/3,"EU GDPR, Data Protection Baseline",Default Group,Security & compliance center,"Data Protection Baseline, EU GDPR",Discover and respond,None
Use Azure Active Directory to respond to DSR requests,0/3,"EU GDPR, Data Protection Baseline",Default Group,Azure Active Directory,"Data Protection Baseline, EU GDPR",Control access,None
Configure email forwarding,0/3,"NIST 800-53, Data Protection Baseline",Default Group,Exchange Online Protection,"Data Protection Baseline, NIST 800-53",Protect information,None
Use permit-by-exception and deny-by-exception practices,0/3,"ISO 27001, NIST 800-53, Data Protection Baseline",Default Group,Cloud App Security,"Data Protection Baseline, ISO 27001, NIST 800-53",Discover and respond,None
Enable and configure Microsoft Defender Antivirus always-on protection in Group Policy,0/3,"NIST 800-53, Data Protection Baseline",Default Group,Microsoft Defender for Endpoint,"Data Protection Baseline, NIST 800-53",Protect against threats,None
Review audit logs in Intune,0/3,"NIST 800-53, Data Protection Baseline",Default Group,Intune,"Data Protection Baseline, NIST 800-53",Manage devices,None
Perform disposition review,0/3,"EU GDPR, NIST 800-53",Default Group,Records management,"EU GDPR, NIST 800-53",Govern information,None
Create customized or use default insider risk management policies for data leaks,0/3,"ISO 27001, EU GDPR",Default Group,Insider risk management,"EU GDPR, ISO 27001",Manage internal risks,None
