Improvement action,Points achieved,Regulations,Group,Solutions,Assessments,Categories,Test status
Maintain records of processing of personal data,0/9,"EU GDPR, Data Protection Baseline",Default Group,Compliance Manager,"Data Protection Baseline, EU GDPR",Manage compliance,None
Protect authenticators commensurate with use,0/9,"ISO 27001, Data Protection Baseline",Default Group,Compliance Manager,"Data Protection Baseline, ISO 27001",Manage compliance,None
Notify personnel upon sanctions,0/9,"ISO 27001, NIST 800-53, Data Protection Baseline",Default Group,Compliance Manager,"Data Protection Baseline, ISO 27001, NIST 800-53",Manage compliance,None
Assess risk in third party relationships,0/9,"ISO 27001, NIST 800-53, Data Protection Baseline",Default Group,Compliance Manager,"Data Protection Baseline, ISO 27001, NIST 800-53",Manage compliance,None
Enforce password complexity,0/9,"ISO 27001, NIST 800-53, Data Protection Baseline",Default Group,Compliance Manager,"Data Protection Baseline, ISO 27001, NIST 800-53",Manage compliance,None
Maintain incident response plan,0/9,"ISO 27001, NIST 800-53, Data Protection Baseline",Default Group,Compliance Manager,"Data Protection Baseline, ISO 27001, NIST 800-53",Manage compliance,None
Disable access immediately upon termination,0/9,"ISO 27001, NIST 800-53, Data Protection Baseline",Default Group,Compliance Manager,"Data Protection Baseline, ISO 27001, NIST 800-53",Manage compliance,None
Require third-party compliance with organizational requirements,0/9,"ISO 27001, NIST 800-53, Data Protection Baseline",Default Group,Compliance Manager,"Data Protection Baseline, ISO 27001, NIST 800-53",Manage compliance,None
Protect passwords with encryption,0/9,"ISO 27001, NIST 800-53, Data Protection Baseline",Default Group,Compliance Manager,"Data Protection Baseline, ISO 27001, NIST 800-53",Manage compliance,None
Distribute policies and procedures,0/9,"NIST 800-53, Data Protection Baseline",Default Group,Compliance Manager,"Data Protection Baseline, NIST 800-53",Manage compliance,None
Enforce logical access,0/9,"ISO 27001, NIST 800-53, Data Protection Baseline",Default Group,Compliance Manager,"Data Protection Baseline, ISO 27001, NIST 800-53",Manage compliance,None
Enforce confidentiality or non-disclosure agreement,0/9,"ISO 27001, NIST 800-53, Data Protection Baseline",Default Group,Compliance Manager,"Data Protection Baseline, ISO 27001, NIST 800-53",Manage compliance,None
Implement password guidelines,0/9,"ISO 27001, NIST 800-53, Data Protection Baseline",Default Group,Compliance Manager,"Data Protection Baseline, ISO 27001, NIST 800-53",Manage compliance,None
Develop and document a business continuity and disaster recovery plan,0/9,"ISO 27001, NIST 800-53, Data Protection Baseline",Default Group,Compliance Manager,"Data Protection Baseline, ISO 27001, NIST 800-53",Manage compliance,None
Identify incident response personnel,0/9,"ISO 27001, NIST 800-53, Data Protection Baseline",Default Group,Compliance Manager,"Data Protection Baseline, ISO 27001, NIST 800-53",Manage compliance,None
Enforce security configuration settings,0/9,"ISO 27001, NIST 800-53, Data Protection Baseline",Default Group,Compliance Manager,"Data Protection Baseline, ISO 27001, NIST 800-53",Manage compliance,None
Enforce rules of behavior and access agreements,0/9,"ISO 27001, NIST 800-53, Data Protection Baseline",Default Group,Compliance Manager,"Data Protection Baseline, ISO 27001, NIST 800-53",Manage compliance,None
Automate information sharing decisions,0/9,"ISO 27001, NIST 800-53, Data Protection Baseline",Default Group,Compliance Manager,"Data Protection Baseline, ISO 27001, NIST 800-53",Manage compliance,None
Incorporate Office 365 into change management processes,0/9,"ISO 27001, NIST 800-53, Data Protection Baseline",Default Group,Compliance Manager,"Data Protection Baseline, ISO 27001, NIST 800-53",Manage compliance,None
Incorporate intune into change management processes,0/9,"NIST 800-53, Data Protection Baseline",Default Group,Compliance Manager,"Data Protection Baseline, NIST 800-53",Manage compliance,None
Manage cryptographic keys,0/9,"ISO 27001, NIST 800-53, Data Protection Baseline",Default Group,Compliance Manager,"Data Protection Baseline, ISO 27001, NIST 800-53",Manage compliance,None
Limit use of unencrypted static authenticators,0/9,"ISO 27001, Data Protection Baseline",Default Group,Compliance Manager,"Data Protection Baseline, ISO 27001",Manage compliance,None
Use non-privileged accounts,0/9,"ISO 27001, NIST 800-53, Data Protection Baseline",Default Group,Compliance Manager,"Data Protection Baseline, ISO 27001, NIST 800-53",Manage compliance,Failed high risk
Verify identity before distributing authenticators,0/9,"ISO 27001, NIST 800-53, Data Protection Baseline",Default Group,Compliance Manager,"Data Protection Baseline, ISO 27001, NIST 800-53",Manage compliance,None
Route traffic through managed network access points,0/9,"ISO 27001, NIST 800-53, Data Protection Baseline",Default Group,Compliance Manager,"Data Protection Baseline, ISO 27001, NIST 800-53",Manage compliance,None
Restrict access to audit information,0/9,"ISO 27001, NIST 800-53, Data Protection Baseline",Default Group,Compliance Manager,"Data Protection Baseline, ISO 27001, NIST 800-53",Manage compliance,None
Restrict access to private keys,0/9,"ISO 27001, NIST 800-53, Data Protection Baseline",Default Group,Azure Active Directory,"Data Protection Baseline, ISO 27001, NIST 800-53",Control access,None
Configure workstations to check for digital certificates,0/9,"ISO 27001, NIST 800-53, Data Protection Baseline",Default Group,Compliance Manager,"Data Protection Baseline, ISO 27001, NIST 800-53",Manage compliance,None
Construct certificate validation path for PKI-based authentication,0/9,"ISO 27001, NIST 800-53, Data Protection Baseline",Default Group,Azure Active Directory,"Data Protection Baseline, ISO 27001, NIST 800-53",Control access,None
Use system clocks for audit records,0/9,"ISO 27001, NIST 800-53, Data Protection Baseline",Default Group,Audit,"Data Protection Baseline, ISO 27001, NIST 800-53",Discover and respond,None
Issue public key certificates,0/9,"ISO 27001, NIST 800-53, Data Protection Baseline",Default Group,Compliance Manager,"Data Protection Baseline, ISO 27001, NIST 800-53",Manage compliance,None
Establish network segmentation for card holder data environment,0/9,"ISO 27001, NIST 800-53, Data Protection Baseline",Default Group,Compliance Manager,"Data Protection Baseline, ISO 27001, NIST 800-53",Manage compliance,None
Refresh authenticators,0/9,"ISO 27001, NIST 800-53, Data Protection Baseline",Default Group,Compliance Manager,"Data Protection Baseline, ISO 27001, NIST 800-53",Manage compliance,None
Disable authenticators upon termination,0/9,"ISO 27001, NIST 800-53, Data Protection Baseline",Default Group,Compliance Manager,"Data Protection Baseline, ISO 27001, NIST 800-53",Manage compliance,None
Prevent identifier re-use,0/9,"ISO 27001, NIST 800-53, Data Protection Baseline",Default Group,Compliance Manager,"Data Protection Baseline, ISO 27001, NIST 800-53",Manage compliance,None
Enforce user uniqueness,0/9,"ISO 27001, NIST 800-53, Data Protection Baseline",Default Group,Compliance Manager,"Data Protection Baseline, ISO 27001, NIST 800-53",Manage compliance,None
Protect data in transit using encryption,0/9,"ISO 27001, EU GDPR, NIST 800-53, Data Protection Baseline",Default Group,Microsoft Information Protection,"Data Protection Baseline, EU GDPR, ISO 27001, NIST 800-53",Protect information,None
Develop risk assessment policies and procedures,0/9,"ISO 27001, NIST 800-53, Data Protection Baseline",Default Group,Compliance Manager,"Data Protection Baseline, ISO 27001, NIST 800-53",Manage compliance,None
Satisfy token quality requirements,0/9,"ISO 27001, NIST 800-53, Data Protection Baseline",Default Group,Compliance Manager,"Data Protection Baseline, ISO 27001, NIST 800-53",Manage compliance,None
Authenticate to cryptographic module,0/9,"ISO 27001, NIST 800-53, Data Protection Baseline",Default Group,Compliance Manager,"Data Protection Baseline, ISO 27001, NIST 800-53",Manage compliance,None
Protect wireless access,0/9,"NIST 800-53, Data Protection Baseline",Default Group,Compliance Manager,"Data Protection Baseline, NIST 800-53",Manage compliance,None
Manage authenticator lifetime and reuse,0/9,"ISO 27001, NIST 800-53, Data Protection Baseline",Default Group,Compliance Manager,"Data Protection Baseline, ISO 27001, NIST 800-53",Manage compliance,None
Assign system identifiers,0/9,"ISO 27001, NIST 800-53, Data Protection Baseline",Default Group,Azure Active Directory,"Data Protection Baseline, ISO 27001, NIST 800-53",Control access,None
Automate account management,0/9,"NIST 800-53, Data Protection Baseline",Default Group,Compliance Manager,"Data Protection Baseline, NIST 800-53",Manage compliance,None
Assess information security events,0/9,"ISO 27001, NIST 800-53, Data Protection Baseline",Default Group,Compliance Manager,"Data Protection Baseline, ISO 27001, NIST 800-53",Manage compliance,None
Change vendor-supplied defaults,0/9,"ISO 27001, NIST 800-53, Data Protection Baseline",Default Group,Compliance Manager,"Data Protection Baseline, ISO 27001, NIST 800-53",Manage compliance,None
Align business objectives and it goals,0/9,"ISO 27001, NIST 800-53, Data Protection Baseline",Default Group,Compliance Manager,"Data Protection Baseline, ISO 27001, NIST 800-53",Manage compliance,None
Classify assets into risk-based categories,0/9,"ISO 27001, NIST 800-53, Data Protection Baseline",Default Group,Compliance Manager,"Data Protection Baseline, ISO 27001, NIST 800-53",Manage compliance,None
Define a physical key management process,0/9,"ISO 27001, NIST 800-53, Data Protection Baseline",Default Group,Compliance Manager,"Data Protection Baseline, ISO 27001, NIST 800-53",Manage compliance,None
Define and secure physical perimeters,0/9,"ISO 27001, NIST 800-53, Data Protection Baseline",Default Group,Compliance Manager,"Data Protection Baseline, ISO 27001, NIST 800-53",Manage compliance,None
Facilitate reviews by regulatory bodies,0/9,Data Protection Baseline,Default Group,Compliance Manager,Data Protection Baseline,Manage compliance,None
Establish requirements for internet service providers,0/9,"NIST 800-53, Data Protection Baseline",Default Group,Compliance Manager,"Data Protection Baseline, NIST 800-53",Manage compliance,None
Secure content transfers,0/9,"NIST 800-53, Data Protection Baseline",Default Group,Compliance Manager,"Data Protection Baseline, NIST 800-53",Manage compliance,None
Manage gateways,0/9,"ISO 27001, NIST 800-53, Data Protection Baseline",Default Group,Compliance Manager,"Data Protection Baseline, ISO 27001, NIST 800-53",Manage compliance,None
Secure commitment from leadership,0/9,"ISO 27001, NIST 800-53, Data Protection Baseline",Default Group,Compliance Manager,"Data Protection Baseline, ISO 27001, NIST 800-53",Manage compliance,None
Define mobile device requirements,0/9,"ISO 27001, NIST 800-53, Data Protection Baseline",Default Group,Compliance Manager,"Data Protection Baseline, ISO 27001, NIST 800-53",Manage compliance,None
Implement a search process for entry and exit,0/9,"NIST 800-53, Data Protection Baseline",Default Group,Compliance Manager,"Data Protection Baseline, NIST 800-53",Manage compliance,None
Implement an automated configuration management tool,0/9,"NIST 800-53, Data Protection Baseline",Default Group,Compliance Manager,"Data Protection Baseline, NIST 800-53",Manage compliance,None
Manage nonlocal maintenance and diagnostic activities,0/9,"ISO 27001, NIST 800-53, Data Protection Baseline",Default Group,Compliance Manager,"Data Protection Baseline, ISO 27001, NIST 800-53",Manage compliance,None
Secure the interface to external systems,0/9,"NIST 800-53, Data Protection Baseline",Default Group,Compliance Manager,"Data Protection Baseline, NIST 800-53",Manage compliance,None
Define requirements for managing assets,0/9,"NIST 800-53, Data Protection Baseline",Default Group,Compliance Manager,"Data Protection Baseline, NIST 800-53",Manage compliance,None
Define requirements for supplying goods and services,0/9,"NIST 800-53, Data Protection Baseline",Default Group,Compliance Manager,"Data Protection Baseline, NIST 800-53",Manage compliance,None
Implement an enterprise architecture framework,0/9,"NIST 800-53, Data Protection Baseline",Default Group,Compliance Manager,"Data Protection Baseline, NIST 800-53",Manage compliance,None
Implement controls to secure alternate work sites,0/9,"ISO 27001, NIST 800-53, Data Protection Baseline",Default Group,Compliance Manager,"Data Protection Baseline, ISO 27001, NIST 800-53",Manage compliance,None
Manage the transportation of assets,0/9,"NIST 800-53, Data Protection Baseline",Default Group,Compliance Manager,"Data Protection Baseline, NIST 800-53",Manage compliance,None
Implement parameters for memorized secret verifiers,0/9,"ISO 27001, NIST 800-53, Data Protection Baseline",Default Group,Compliance Manager,"Data Protection Baseline, ISO 27001, NIST 800-53",Manage compliance,None
Monitor audit processing activities,0/9,"NIST 800-53, Data Protection Baseline",Default Group,Compliance Manager,"Data Protection Baseline, NIST 800-53",Manage compliance,None
Use dedicated machines for administrative tasks,0/9,"NIST 800-53, Data Protection Baseline",Default Group,Compliance Manager,"Data Protection Baseline, NIST 800-53",Manage compliance,None
Design an access control model,0/9,"NIST 800-53, Data Protection Baseline",Default Group,Compliance Manager,"Data Protection Baseline, NIST 800-53",Manage compliance,None
Determine assertion requirements,0/9,"ISO 27001, NIST 800-53, Data Protection Baseline",Default Group,Compliance Manager,"Data Protection Baseline, ISO 27001, NIST 800-53",Manage compliance,None
Determine supplier contract obligations,0/9,"ISO 27001, NIST 800-53, Data Protection Baseline",Default Group,Compliance Manager,"Data Protection Baseline, ISO 27001, NIST 800-53",Manage compliance,None
Develop a tailored control baseline and profile,0/9,Data Protection Baseline,Default Group,Compliance Manager,Data Protection Baseline,Manage compliance,None
Develop and document a DDoS response plan,0/9,"NIST 800-53, Data Protection Baseline",Default Group,Compliance Manager,"Data Protection Baseline, NIST 800-53",Manage compliance,None
Obtain consent prior to sending electronic messages,0/9,"ISO 27001, Data Protection Baseline",Default Group,Compliance Manager,"Data Protection Baseline, ISO 27001",Manage compliance,None
Develop and document application security requirements,0/9,"ISO 27001, NIST 800-53, Data Protection Baseline",Default Group,Compliance Manager,"Data Protection Baseline, ISO 27001, NIST 800-53",Manage compliance,None
Perform data center resilience and risk assessment,0/9,Data Protection Baseline,Default Group,Compliance Manager,Data Protection Baseline,Manage compliance,None
Perform a data protection impact assessment,0/9,"EU GDPR, Data Protection Baseline",Default Group,Compliance Manager,"Data Protection Baseline, EU GDPR",Manage compliance,None
Use Microsoft Defender ATP to explore security recommendations,0/9,"ISO 27001, NIST 800-53, Data Protection Baseline",Default Group,Microsoft Defender for Endpoint,"Data Protection Baseline, ISO 27001, NIST 800-53",Protect against threats,None
Perform threat modeling,0/9,"ISO 27001, NIST 800-53, Data Protection Baseline",Default Group,Compliance Manager,"Data Protection Baseline, ISO 27001, NIST 800-53",Manage compliance,None
Develop business classification schemes,0/9,"ISO 27001, NIST 800-53, Data Protection Baseline",Default Group,Compliance Manager,"Data Protection Baseline, ISO 27001, NIST 800-53",Manage compliance,None
Manage availability and capacity,0/9,"ISO 27001, EU GDPR, NIST 800-53, Data Protection Baseline",Default Group,Compliance Manager,"Data Protection Baseline, EU GDPR, ISO 27001, NIST 800-53",Manage compliance,None
Develop and maintain baseline configurations,0/9,"NIST 800-53, Data Protection Baseline",Default Group,Compliance Manager,"Data Protection Baseline, NIST 800-53",Manage compliance,None
Develop system and communications protection policies and procedures,0/9,"NIST 800-53, Data Protection Baseline",Default Group,Compliance Manager,"Data Protection Baseline, NIST 800-53",Manage compliance,None
Document and maintain a network diagram,0/9,Data Protection Baseline,Default Group,Compliance Manager,Data Protection Baseline,Manage compliance,None
Manage concurrent active sessions,0/9,Data Protection Baseline,Default Group,Compliance Manager,Data Protection Baseline,Manage compliance,None
Prohibit the use of cached authenticators,0/9,"ISO 27001, Data Protection Baseline",Default Group,Compliance Manager,"Data Protection Baseline, ISO 27001",Manage compliance,None
Document and report alternative security measures,0/9,"ISO 27001, Data Protection Baseline",Default Group,Compliance Manager,"Data Protection Baseline, ISO 27001",Manage compliance,None
Manage contacts for authorities and special interest groups,0/9,"ISO 27001, NIST 800-53, Data Protection Baseline",Default Group,Compliance Manager,"Data Protection Baseline, ISO 27001, NIST 800-53",Manage compliance,None
Document mobility training,0/9,"ISO 27001, NIST 800-53, Data Protection Baseline",Default Group,Compliance Manager,"Data Protection Baseline, ISO 27001, NIST 800-53",Manage compliance,None
Manage enterprise architecture,0/9,"NIST 800-53, Data Protection Baseline",Default Group,Compliance Manager,"Data Protection Baseline, NIST 800-53",Manage compliance,None
Provide a mechanism to withdraw consent,0/9,"EU GDPR, Data Protection Baseline",Default Group,Compliance Manager,"Data Protection Baseline, EU GDPR",Manage compliance,None
Enable and maintain an uninterruptible power supply,0/9,"ISO 27001, NIST 800-53, Data Protection Baseline",Default Group,Compliance Manager,"Data Protection Baseline, ISO 27001, NIST 800-53",Manage compliance,None
Provide contingency training,0/9,"NIST 800-53, Data Protection Baseline",Default Group,Compliance Manager,"Data Protection Baseline, NIST 800-53",Manage compliance,None
Use security baselines,0/9,Data Protection Baseline,Default Group,Microsoft Defender for Office 365,Data Protection Baseline,Protect against threats,None
Provide secure name and address resolution services,0/9,"NIST 800-53, Data Protection Baseline",Default Group,Compliance Manager,"Data Protection Baseline, NIST 800-53",Manage compliance,None
Reauthenticate or terminate a user session,0/9,"NIST 800-53, Data Protection Baseline",Default Group,Compliance Manager,"Data Protection Baseline, NIST 800-53",Manage compliance,None
Require compliance with intellectual property rights,0/9,"ISO 27001, NIST 800-53, Data Protection Baseline",Default Group,Compliance Manager,"Data Protection Baseline, ISO 27001, NIST 800-53",Manage compliance,None
Verify implementation of security controls,0/9,"NIST 800-53, Data Protection Baseline",Default Group,Compliance Manager,"Data Protection Baseline, NIST 800-53",Manage compliance,None
Establish a configuration control board,0/9,"NIST 800-53, Data Protection Baseline",Default Group,Compliance Manager,"Data Protection Baseline, NIST 800-53",Manage compliance,None
Require security clearance before accessing sensitive data on government property,0/9,Data Protection Baseline,Default Group,Compliance Manager,Data Protection Baseline,Manage compliance,None
Control maintenance and repair activities,0/9,"ISO 27001, NIST 800-53, Data Protection Baseline",Default Group,Compliance Manager,"Data Protection Baseline, ISO 27001, NIST 800-53",Manage compliance,None
Establish a control selection process,0/9,Data Protection Baseline,Default Group,Compliance Manager,Data Protection Baseline,Manage compliance,None
Control physical access,0/9,"ISO 27001, NIST 800-53, Data Protection Baseline",Default Group,Compliance Manager,"Data Protection Baseline, ISO 27001, NIST 800-53",Manage compliance,None
Establish a data leakage management procedure,0/9,"ISO 27001, NIST 800-53, Data Protection Baseline",Default Group,Compliance Manager,"Data Protection Baseline, ISO 27001, NIST 800-53",Manage compliance,None
Establish a risk management strategy,0/9,"ISO 27001, NIST 800-53, Data Protection Baseline",Default Group,Compliance Manager,"Data Protection Baseline, ISO 27001, NIST 800-53",Manage compliance,None
Create a data inventory,0/9,"ISO 27001, NIST 800-53, Data Protection Baseline",Default Group,Compliance Manager,"Data Protection Baseline, ISO 27001, NIST 800-53",Manage compliance,None
Establish a password policy,0/9,"ISO 27001, NIST 800-53, Data Protection Baseline",Default Group,Compliance Manager,"Data Protection Baseline, ISO 27001, NIST 800-53",Manage compliance,None
Establish a self assessment process,0/9,Data Protection Baseline,Default Group,Compliance Manager,Data Protection Baseline,Manage compliance,None
Establish a threat intelligence program,0/9,"NIST 800-53, Data Protection Baseline",Default Group,Compliance Manager,"Data Protection Baseline, NIST 800-53",Manage compliance,None
Establish and document a configuration management plan,0/9,"NIST 800-53, Data Protection Baseline",Default Group,Compliance Manager,"Data Protection Baseline, NIST 800-53",Manage compliance,None
Establish procedures to secure infrastructure,0/9,Data Protection Baseline,Default Group,Compliance Manager,Data Protection Baseline,Manage compliance,None
Establish authenticator types and processes,0/9,"ISO 27001, NIST 800-53, Data Protection Baseline",Default Group,Compliance Manager,"Data Protection Baseline, ISO 27001, NIST 800-53",Manage compliance,None
Manage asset transportation,0/9,"ISO 27001, NIST 800-53, Data Protection Baseline",Default Group,Compliance Manager,"Data Protection Baseline, ISO 27001, NIST 800-53",Manage compliance,None
Establish backup policies and procedures,0/9,"NIST 800-53, Data Protection Baseline",Default Group,Compliance Manager,"Data Protection Baseline, NIST 800-53",Manage compliance,None
Address coding vulnerabilities,0/9,"ISO 27001, NIST 800-53, Data Protection Baseline",Default Group,Compliance Manager,"Data Protection Baseline, ISO 27001, NIST 800-53",Manage compliance,None
Establish policies for supply chain risk management,0/9,"ISO 27001, NIST 800-53, Data Protection Baseline",Default Group,Compliance Manager,"Data Protection Baseline, ISO 27001, NIST 800-53",Manage compliance,None
Define cryptographic use,0/9,"ISO 27001, NIST 800-53, Data Protection Baseline",Default Group,Compliance Manager,"Data Protection Baseline, ISO 27001, NIST 800-53",Manage compliance,None
Define organizational requirements for cryptographic key management,0/9,"ISO 27001, NIST 800-53, Data Protection Baseline",Default Group,Compliance Manager,"Data Protection Baseline, ISO 27001, NIST 800-53",Manage compliance,None
Document remediation actions for policy and procedure violations,0/9,Data Protection Baseline,Default Group,Compliance Manager,Data Protection Baseline,Manage compliance,None
Implement training for protecting authenticators,0/9,"ISO 27001, NIST 800-53, Data Protection Baseline",Default Group,Compliance Manager,"Data Protection Baseline, ISO 27001, NIST 800-53",Manage compliance,None
Consumer personal information opt out rights,0/9,"EU GDPR, Data Protection Baseline",Default Group,Compliance Manager,"Data Protection Baseline, EU GDPR",Manage compliance,None
Determine the notification requirements to data subjects,0/9,"EU GDPR, Data Protection Baseline",Default Group,Compliance Manager,"Data Protection Baseline, EU GDPR",Manage compliance,None
Display prominent privacy notifications,0/9,"EU GDPR, Data Protection Baseline",Default Group,Compliance Manager,"Data Protection Baseline, EU GDPR",Manage compliance,None
Document protection of personal data in acquisition contracts,0/9,"ISO 27001, EU GDPR, NIST 800-53, Data Protection Baseline",Default Group,Compliance Manager,"Data Protection Baseline, EU GDPR, ISO 27001, NIST 800-53",Manage compliance,None
Implement privacy notice delivery methods,0/9,"EU GDPR, Data Protection Baseline",Default Group,Compliance Manager,"Data Protection Baseline, EU GDPR",Manage compliance,None
Manage compliance activities,0/9,"ISO 27001, EU GDPR, Data Protection Baseline",Default Group,Compliance Manager,"Data Protection Baseline, EU GDPR, ISO 27001",Manage compliance,None
Obfuscate sensitive data,0/9,"ISO 27001, EU GDPR, Data Protection Baseline",Default Group,Compliance Manager,"Data Protection Baseline, EU GDPR, ISO 27001",Manage compliance,None
Obtain authorization from the regulator to process personal data,0/9,"EU GDPR, Data Protection Baseline",Default Group,Compliance Manager,"Data Protection Baseline, EU GDPR",Manage compliance,None
"Manage the input, output, processing, and storage of data",0/9,Data Protection Baseline,Default Group,Microsoft Information Protection,Data Protection Baseline,Protect information,None
Obtain consent prior to collection or processing of personal data,0/9,"EU GDPR, Data Protection Baseline",Default Group,Compliance Manager,"Data Protection Baseline, EU GDPR",Manage compliance,None
Protect special information,0/9,"ISO 27001, EU GDPR, NIST 800-53, Data Protection Baseline",Default Group,Compliance Manager,"Data Protection Baseline, EU GDPR, ISO 27001, NIST 800-53",Manage compliance,None
Protect personal data of children and elderly,0/9,"ISO 27001, EU GDPR, Data Protection Baseline",Default Group,Compliance Manager,"Data Protection Baseline, EU GDPR, ISO 27001",Manage compliance,None
Provide privacy notice,0/9,"EU GDPR, Data Protection Baseline",Default Group,Compliance Manager,"Data Protection Baseline, EU GDPR",Manage compliance,None
Provide privacy training,0/9,"ISO 27001, EU GDPR, Data Protection Baseline",Default Group,Compliance Manager,"Data Protection Baseline, EU GDPR, ISO 27001",Manage compliance,None
